{
  "lenspub": "0.1",
  "type": "LensDiff",
  "comparison": "self-over-time",
  "generated": "2026-07-09T16:20:00Z",
  "from": {
    "id": "https://avery.example/lenses/avery-daily",
    "name": "avery-daily",
    "lensVersion": "1.3.0",
    "hash": "23cbfd797df94bb6f8f68c1e9a46f42a3481f6301bce1cabf9c9d7b550db5164"
  },
  "to": {
    "id": "https://avery.example/lenses/avery-daily",
    "name": "avery-daily",
    "lensVersion": "1.4.0",
    "hash": "b8cd3ee8c4df7e51a1341f55e7acada58bdc3ecdd4bed779b1ead9564be35d65"
  },
  "changes": [
    {
      "op": "replace",
      "path": "/interpretation/priorities/1/weight",
      "before": 0.4,
      "after": 0.7,
      "category": "priorities",
      "impact": "minor",
      "summary": "Raises the emphasis on topic 'model-evaluation' in the tech-research domain scope from 0.4 to 0.7."
    },
    {
      "op": "add",
      "path": "/interpretation/sources/trusted/3",
      "after": {
        "origin": "openreview.net",
        "weight": 0.9,
        "note": "Reviews are public and attributable to named or accountable reviewers."
      },
      "category": "sources",
      "impact": "minor",
      "summary": "Adds openreview.net as a trusted source with weight 0.9."
    },
    {
      "op": "replace",
      "path": "/adaptation/domainPolicies/0/policy",
      "before": "balanced",
      "after": "locked",
      "category": "adaptation",
      "impact": "major",
      "summary": "Changes the Adaptation Policy for the politics domain scope from Balanced to Locked, so the lens will no longer propose changes in that scope."
    }
  ],
  "totals": {
    "added": 1,
    "removed": 0,
    "replaced": 2,
    "highestImpact": "major"
  }
}
