{
  "lenspub": "0.1",
  "type": "LensDiff",
  "from": {
    "id": "https://avery.example/lenses/avery-daily",
    "name": "Avery's Daily Lens",
    "lensVersion": "1.3.0",
    "hash": "sha256:89232b5486311810243c7c067c76cd83bac48e3117359acebd5195dbc93a7b70"
  },
  "to": {
    "id": "https://avery.example/lenses/avery-daily",
    "name": "Avery's Daily Lens",
    "lensVersion": "1.4.0",
    "hash": "sha256:0d245b475963843301e4ad4c5117fd0469181d8ae08338bb905b4f3d3bf54019"
  },
  "generated": "2026-06-19T18:22:00Z",
  "comparison": "self-over-time",
  "changes": [
    {
      "op": "add",
      "path": "/interpretation/sources/trusted/0",
      "after": {
        "origin": "example-journal.example",
        "weight": 0.8,
        "note": "They publish their testing methodology and print corrections. Checked their benchmark writeups twice; both held up."
      },
      "category": "sources",
      "impact": "minor",
      "summary": "Added example-journal.example as a trusted source with weight 0.8."
    },
    {
      "op": "replace",
      "path": "/interpretation/priorities/1/weight",
      "before": 0.5,
      "after": 0.7,
      "category": "priorities",
      "impact": "minor",
      "summary": "Raised the weight of the 'student data privacy' priority from 0.5 to 0.7."
    }
  ],
  "totals": {
    "added": 1,
    "removed": 0,
    "replaced": 1,
    "highestImpact": "minor"
  }
}
